{
  "knowledge_pack_id": "openfoam_pack",
  "schema_version": "1.0.0",
  "tool_id": "openfoam",
  "tool_name": "OpenFOAM",
  "module_class": "application",
  "library_version": "11.x",
  "bindings": ["C++", "CLI"],
  "scope": {
    "solves": ["Internal flow CFD"],
    "not_for": ["Reaction mechanism authoring"]
  },
  "core_objects": [
    { "name": "fvSchemes", "kind": "config", "role": "Numerics selection" }
  ],
  "best_for": ["Finite-volume CFD workflows"],
  "anti_patterns": ["Skipping mesh quality checks before solving"],
  "interfaces": {
    "inputs": ["Mesh", "case dictionaries"],
    "outputs": ["Fields", "residual histories"]
  },
  "integration_refs": ["artifact://decision-log/openfoam/default-stack"],
  "recipe_refs": ["artifact://recipe-object/openfoam/steady_internal_flow"],
  "adapter_refs": ["artifact://execution-adapter-spec/openfoam/default"],
  "evidence_refs": ["artifact://evidence-bundle/openfoam/default"],
  "minutes_source_refs": ["minutes://table1#L298"],
  "environment_refs": ["artifact://environment-spec/eng_cfd_docker"],
  "provenance": {
    "sources": ["https://www.openfoam.com/"],
    "examples": ["simpleFoam motorBike"],
    "benchmarks": ["lidDrivenCavity"]
  }
}
